projectId,department,document_type,title,progress,views,project_card_size_Kb
145676,Минприроды России,Проект постановления Правительства Российской Федерации,О создании национального парка «Фролихинский»,1,311,0.27734375
145675,Минпромторг России,Проект ведомственного акта,"Об утверждении Порядка признания результатов измерений, полученных с применением средств измерений, принадлежащих иностранным организациям",1,357,0.4072265625
145674,Минпросвещения России,Проект ведомственного акта,"Об утверждении Порядка составления и утверждения отчета о результатах деятельности федеральных государственных бюджетных и автономных учреждений, находящихся в ведении Министерства просвещения Российской Федерации, и об использовании закрепленного за ними государственного имущества",1,228,0.6044921875
145672,Минпромторг России,Проект постановления Правительства Российской Федерации,"О внесении изменений в Перечень измерений, относящихся к сфере государственного регулирования обеспечения единства измерений, утвержденный постановлением Правительства Российской Федерации от 16 ноября 2020 г. № 1847",1,358,0.5927734375
145670,Минюст России,Проект ведомственного акта,Об утверждении типового должностного регламента федерального государственного гражданского служащего центрального аппарата Министерства юстиции Российской Федерации,1,245,0.4375
145668,Минпромторг России,Проект постановления Правительства Российской Федерации,Об утверждении Положения о Государственной метрологической службе,0,314,0.27734375
145667,Минпромторг России,Проект постановления Правительства Российской Федерации,"О внесении изменений в Перечень измерений, относящихся к сфере государственного регулирования обеспечения единства измерений, утвержденный постановлением Правительства Российской Федерации от 16 ноября 2020 г. № 1847",0,258,0.6123046875
145666,Минстрой России,Проект ведомственного акта,"О ежемесячной процентной надбавке к должностному окладу федеральных государственных гражданских служащих Министерства строительства и жилищно-коммунального хозяйства Российский Федерации и работников подведомственных Министерству строительства и жилищно-коммунального хозяйства Российский Федерации организаций, допущенных к государственной тайне на постоянной основе",1,289,0.5927734375
145665,Минпромторг России,Проект постановления Правительства Российской Федерации,О признании утратившим силу постановления Правительства Российской Федерации от 2 апреля 2015 г. № 311,1,415,0.373046875
145663,Роспотребнадзор,Проект ведомственного акта,"Приказ Роспотребнадзора ""О внесении изменений в Положение
о комиссиях Роспотребнадзора
по соблюдению требований
к служебному поведению федеральных государственных гражданских служащих и работников организаций, созданных для выполнения задач, поставленных перед Роспотребнадзором,
и урегулированию конфликта интересов, утвержденное приказом Роспотребнадзора от 13.07.2015 № 616""",1,256,0.5810546875
145669,ФАС России,Проект ведомственного акта,"Об утверждении Методических указаний по определению размера денежных средств, необходимых для обеспечения безопасной эксплуатации атомных станций и компенсации затрат на возмещение недополученных доходов и (или) финансового обеспечения (возмещения) затрат энергосбытовой организации, уполномоченной Правительством Российской Федерации на осуществление купли-продажи электрической энергии (мощности) для целей поставки электрической энергии (мощности) на территориях новых субъектов Российской Федерации, не обеспеченных за счет средств федерального бюджета, и соответствующей ему составляющей цены на мощность и о внесении изменения в приказ ФСТ России от 13 октября 2010 г. № 485-э",1,300,0.580078125
145664,Минцифры России,Проект постановления Правительства Российской Федерации,Проект постановления Правительства Российской Федерации «О внесении изменений в некоторые акты Правительства Российской Федерации,1,3087,0.4296875
145662,Минсельхоз России,Проект ведомственного акта,"Об образовании рыбохозяйственной заповедной зоны «Река Опала», а также утверждении паспорта рыбохозяйственной заповедной зоны «Река Опала»",0.75,660,0.3828125
145658,Минобороны России,Проект федерального закона,"О внесении изменений в статьи 18 и 21 Федерального закона ""О накопительно-ипотечной системе жилищного обеспечения военнослужащих""",1,352,0.369140625
145657,Минсельхоз России,Проект постановления Правительства Российской Федерации,"О внесении изменений
в некоторые акты Правительства Российской Федерации",1,375,0.326171875
145655,Минсельхоз России,Проект постановления Правительства Российской Федерации,"О внесении изменений
в некоторые акты Правительства Российской Федерации",1,398,0.326171875
145656,Минтранс России,Проект ведомственного акта,"О внесении изменений в Правила подготовки документации по организации дорожного движения, утвержденные приказом Министерства транспорта Российской Федерации от 30 июля 2020 г. № 274",0,493,0.462890625
145650,Минприроды России,Проект ведомственного акта,Об утверждении Положения о государственном природном заказнике федерального значения «Канозерский»,1,308,0.3212890625
145661,МЧС России,Проект постановления Правительства Российской Федерации,О внесении изменения в постановление Правительства Российской Федерации от 24 апреля 2013 г. № 369,0,486,0.3486328125
145652,Центральный банк Российской Федерации,Проект ведомственного акта,"Об образцах форменной одежды, нагрудного знака (жетона) и служебного удостоверения работников Банка России, осуществляющих функции по охране денежных средств, драгоценных металлов, внутренних ценных бумаг и валютных ценностей, корреспонденции и предметов, содержащих сведения, отнесенные к государственной тайне, при их транспортировании (перевозке), а также по охране объектов Банка России, предназначенных для хранения такого имущества, и образцах форменной одежды, нагрудного знака (жетона) и служебного удостоверения работников Российского объединения инкассации (РОСИНКАС) Центрального банка Российской Федерации (Банка России), осуществляющих функции по охране денежных средств, драгоценных металлов, внутренних ценных бумаг и валютных ценностей при их транспортировании (перевозке), инкассации наличных денежных средств, а также по охране объектов Российского объединения инкассации (РОСИНКАС) Центрального банка Российской Федерации (Банка России) и объектов Банка России, предназначенных для хранения такого имущества",1,285,0.62109375
145653,Минпромторг России,Проект ведомственного акта,"Об утверждении методики оценки эффективности налоговых расходов Российской Федерации, отнесенных к государственной программе Российской Федерации ""Развитие промышленности и повышение ее конкурентоспособности""",1,391,0.5244140625
145654,Минтранс России,Проект постановления Правительства Российской Федерации,О внесении изменений в некоторые акты Правительства Российской Федерации,1,490,0.322265625
145649,Минэкономразвития России,Проект федерального закона,О внесении изменений в статью 32 Федерального закона «Об особых экономических зонах в Российской Федерации» и статью 22 Земельного кодекса Российской Федерации,1,407,0.4384765625
145648,Минсельхоз России,Проект постановления Правительства Российской Федерации,О введении временного запрета на вывоз семян рапса из Российской Федерации,1,439,0.328125
145646,Минтруд России,Проект ведомственного акта,Об утверждении профессионального стандарта «Размольщик»,1,212,0.236328125
145645,Минтруд России,Проект ведомственного акта,Об утверждении профессионального стандарта «Работник по подготовке массы для производства бумаги и картона»,1,212,0.330078125
145644,Минтруд России,Проект ведомственного акта,Об утверждении профессионального стандарта «Специалист систем автоматизированного проектирования мебели и конструкций из древесины и древесных материалов»,1,213,0.4189453125
145643,Минтруд России,Проект ведомственного акта,Об утверждении профессионального стандарта «Отбельщик целлюлозы»,1,209,0.2529296875
145642,Минтруд России,Проект ведомственного акта,Об утверждении профессионального стандарта «Специалист по контролю качества в деревообрабатывающем производстве»,1,214,0.341796875
145640,Минвостокразвития России,Проект ведомственного акта,"О внесении изменений в Положение об оплате труда работников федерального казенного учреждения «Объект № 5066» Министерства Российской Федерации по развитию Дальнего Востока и Арктики, утвержденное приказом Минвостокразвития России от 17 августа 2022 г. № 105",1,239,0.5966796875
145641,Минпромторг России,Проект ведомственного акта,"О внесении изменений в технические характеристики оборудования стационарной автомобильной зарядной станции публичного доступа, обеспечивающей возможность быстрой зарядки электрического автомобильного транспорта, утвержденные приказом Министерства промышленности и торговли Российской Федерации от 29 апреля 2022 г. № 1776",1,312,0.6005859375
145639,МВД России,Проект ведомственного акта,"Об утверждении Порядка выплаты ежемесячной надбавки к должностному окладу за особые условия гражданской службы, премий, в том числе за выполнение особо важных
и сложных заданий, материальной помощи и единовременного поощрения федеральным государственным гражданским служащим Министерства внутренних дел Российской Федерации",1,356,0.5751953125
145637,Минсельхоз России,Проект постановления Правительства Российской Федерации,О внесении изменения в постановление Правительства Российской Федерации от 4 декабря 2021 г. № 2196,1,358,0.3642578125
145636,МВД России,Проект ведомственного акта,Об утверждении Порядка и сроков работы конкурсной комиссии Министерства внутренних дел Российской Федерации по вопросам федеральной государственной гражданской службы и Методики проведения конкурса на замещение вакантной должности федеральной государственной гражданской службы в Министерстве внутренних дел Российской Федерации,1,244,0.57421875
145635,Казначейство России,Проект ведомственного акта,Об учреждении медали «За Доблестное Служение»,1,182,0.2255859375
145634,Минсельхоз России,Распоряжение правительства РФ,О внесении изменений в распоряжение Правительства Российской Федерации от 8 сентября 2022 г. № 2567-р»,1,373,0.3203125
145632,Минфин России,Проект постановления Правительства Российской Федерации,О представлении Президенту Российской Федерации для внесения на ратификацию Протокола о внесении изменений в Договор о Таможенном кодексе Евразийского экономического союза от 11 апреля 2017 года,1,305,0.5341796875
145629,Росалкогольтабакконтроль,Проект ведомственного акта,"О признании утратившим силу приказа Федеральной службы по регулированию алкогольного рынка от 19 декабря 2017 г. № 423 «Об аттестации экспертов, привлекаемых Федеральной службой по регулированию алкогольного рынка (территориальным органом Федеральной службы по регулированию алкогольного рынка) к проведению мероприятий по контролю в соответствии с Федеральным законом «О защите прав юридических лиц и индивидуальных предпринимателей при осуществлении государственного контроля (надзора) и муниципального контроля»",1,273,0.5986328125
145630,Минспорт России,Проект ведомственного акта,"О внесении изменений в порядок включения физкультурных и спортивных мероприятий (в том числе значимых международных официальных физкультурных мероприятий и спортивных мероприятий) в Единый календарный план межрегиональных, всероссийских и международных физкультурных мероприятий и спортивных мероприятий, утвержденный приказом Министерства спорта Российской Федерации от 27.08.2021 № 667",1,260,0.58984375
145627,Минпромторг России,Проект постановления Правительства Российской Федерации,"О проведении на территории Российской Федерации эксперимента по маркировке средствами идентификации отдельных видов пиротехнических изделий, огнетушителей и средств обеспечения пожарной безопасности",1,1924,0.5625
145628,Минтранс России,Проект постановления Правительства Российской Федерации,Проект постановления Правительства Российской Федерации «О внесении изменений в постановление Правительства Российской Федерации от 5 октября 2020 г. № 1605» (далее – проект постановления).,1,1098,0.5263671875
145626,ФНС России,Проект ведомственного акта,"Об утверждении формы и формата представления сведений о членах саморегулируемых организаций арбитражных управляющих, а также порядка заполнения формы",1,278,0.3984375
145625,Минфин России,Проект федерального закона,О ратификации Протокола о внесении изменений в Договор о Таможенном кодексе Евразийского экономического союза от 11 апреля 2017 года,1,316,0.365234375
145622,Росавиация,Проект ведомственного акта,Приказ об установлении приаэродромной территории аэродрома гражданской авиации Пенза,1,265,0.2822265625
145624,ФСО России,Проект ведомственного акта,"Об утверждении Типового положения о подразделении ФСО России, являющемся юридическим лицом",0,279,0.30078125
145623,Минтранс России,Проект ведомственного акта,"Об установлении Порядка оформления решений о плавании судов под флагами иностранных государств по внутренним водным путям Российской Федерации, за исключением спортивных парусных судов и прогулочных судов, плавающих под флагами иностранных государств",1,263,0.591796875
145620,МЧС России,Проект ведомственного акта,"О внесении изменений в перечень индикаторов риска
нарушения обязательных требований при осуществлении
федерального государственного пожарного надзора, утвержденный приказом МЧС России от 7 июня 2021 г. № 364",1,438,0.4951171875
145618,Минфин России,Проект ведомственного акта,"О внесении изменений в перечень индикаторов риска нарушения обязательных требований по федеральному государственному контролю (надзору) за соблюдением законодательства Российской Федерации о применении контрольно-кассовой техники, в том числе за полнотой учета выручки в организациях и у индивидуальных предпринимателей, утвержденный приказом Министерства финансов Российской Федерации от 06.06.2023 № 88н",0,381,0.5869140625
145617,ФТС России,Проект ведомственного акта,"Об утверждении Порядка использования личного кабинета и организации обмена электронными документами и (или) сведениями между таможенными органами и декларантами, перевозчиками, лицами, осуществляющими деятельность в сфере таможенного дела, уполномоченными экономическими операторами, правообладателями и иными лицами, а также Порядка получения доступа декларантов, перевозчиков, лиц, осуществляющих деятельность в сфере таможенного дела, уполномоченных экономических операторов, правообладателей и иных лиц к личному кабинету",1,381,0.58984375
