projectId,department,document_type,title,progress,views,project_card_size_Kb
145487,МВД России,Проект постановления Правительства Российской Федерации,О внесении изменений в Правила осуществления миграционного учета иностранных граждан и лиц без гражданства в Российской Федерации,1,514,0.416015625
145489,МИД России,Проект ведомственного акта,"О внесении изменения в пункт 11 Служебного распорядка центрального аппарата Министерства иностранных дел Российской Федерации, территориальных органов - представительств Министерства иностранных дел Российской Федерации на территории Российской Федерации, дипломатических представительств и консульских учреждений Российской Федерации, представительств Российской Федерации при международных организациях (межгосударственных, межправительственных), утвержденного приказом Министерства иностранных дел Российской Федерации от 23 июля 2009 г. № 11868",0,280,0.5947265625
145486,Росжелдор,Проект ведомственного акта,"Об утверждении Положения о порядке выплаты премий, материальной помощи, единовременной выплаты при предоставлении ежегодного оплачиваемого
отпуска и единовременных поощрений федеральным государственным гражданским служащим и работникам, замещающим должности, не являющиеся должностями федеральной государственной гражданской службы центрального аппарата Федерального агентства железнодорожного транспорта",1,279,0.580078125
145485,Минтруд России,Проект ведомственного акта,Об утверждении разъяснения о порядке применения пункта 3 части 1 статьи 32 Федерального закона от 28 декабря 2013 г. № 400-ФЗ «О страховых пенсиях»,1,299,0.3837890625
145481,Минтруд России,Проект ведомственного акта,"Об утверждении форм
документов кадровой работы на государственной гражданской службе
Российской Федерации при формировании федерального кадрового резерва",1,263,0.416015625
145484,МИД России,Проект ведомственного акта,"О внесении изменений в Положение о территориальном органе - Представительстве Министерства иностранных дел Российской Федерации на территории Российской Федерации и Перечень территориальных органов - Представительств Министерства иностранных дел Российской Федерации на территории Российской Федерации, утвержденные приказом министерства иностранных дел Российской Федерации от 22 ноября 2011 г. № 21341",0,300,0.59765625
145479,ФНС России,Проект ведомственного акта,Об утверждении Порядка выдачи удостоверения ветерана боевых действий в Федеральной налоговой службе,1,270,0.3076171875
145480,Минздрав России,Проект постановления Правительства Российской Федерации,Об утверждении Положения о независимой медицинской экспертизе,1,558,0.302734375
145477,Минкультуры России,Проект ведомственного акта,"О внесении изменений в Положение о едином государственном реестре объектов культурного наследия (памятников истории и культуры) народов Российской Федерации, утвержденное приказом Минкультуры России от 3 октября 2011 г. № 954",1,299,0.541015625
145478,Минфин России,Проект постановления Правительства Российской Федерации,О внесении изменения в постановление Правительства Российской Федерации от 14 августа 2020 г. № 1216,0,439,0.3623046875
145475,Минюст России,Проект ведомственного акта,"О внесении изменений в приложение № 1 к Порядку обеспечения безопасности объектов уголовно-исполнительной системы, а также органов Министерства юстиции Российской Федерации, утвержденному приказом Минюста России от 11.10.2018 № 211",1,275,0.5400390625
145476,Минюст России,Проект ведомственного акта,"Об утверждении требований к оборудованию и программному обеспечению профессиональной коллекторской организации, а также кредитной или микрофинансовой организации, включенных в перечень кредитных и микрофинансовых организаций, осуществляющих деятельность по возврату просроченной задолженности физических лиц",0,341,0.5830078125
145474,Минпромторг России,Проект ведомственного акта,Об утверждении образца и порядка использования и прекращения использования знака Российская промышленная продукция,1,277,0.3515625
145473,Минспорт России,Проект ведомственного акта,Порядок разработки общероссийскими спортивными федерациями правил вида спорта или видов спорта и представление их на утверждение,1,267,0.3701171875
145472,Минфин России,Проект ведомственного акта,"Об утверждении типовой формы соглашения о взаимодействии, заключаемого между уполномоченным экономическим оператором и уполномоченным таможенным органом",1,314,0.412109375
145469,Минспорт России,Проект ведомственного акта,Квалификационные требования к присвоению соответствующих квалификационных категорий спортивных судей по виду спорта «тяжелая атлетика»,1,256,0.3955078125
145471,Минпромторг России,Проект ведомственного акта,Об утверждении образца и порядка использования и прекращения использования знака Российская промышленная продукция,0,317,0.3828125
145470,Минтруд России,Проект постановления Правительства Российской Федерации,О межведомственных комиссиях субъектов Российской Федерации по противодействию нелегальной занятости,0,1204,0.3818359375
145467,Минприроды России,Проект постановления Правительства Российской Федерации,О внесении изменений в постановление Правительства Российской Федерации от 20 декабря 2019 г. № 1727,1,441,0.365234375
145468,Ростехнадзор,Проект ведомственного акта,"О признании утратившими силу
некоторых приказов Федеральной службы по экологическому, технологическому и атомному надзору в области безопасного использования и содержания подъемных платформ для инвалидов,
пассажирских конвейеров (движущихся пешеходных дорожек)
и эскалаторов, за исключением эскалаторов в метрополитенах",1,275,0.5634765625
145466,Минприроды России,Проект ведомственного акта,"проект приказа Минприроды России «О внесении изменений в Правила создания и выделения объектов лесного семеноводства (лесосеменных плантаций, постоянных
лесосеменных участков и подобных объектов), утвержденные приказом Министерства природных ресурсов и экологии Российской Федерации от 20 октября 2015 г. № 438»",1,351,0.5830078125
145465,Минпромторг России,Проект Указа Президента Российской Федерации,"Об имущественном взносе Российской Федерации в Государственную корпорацию по содействию разработке, производству и экспорту высокотехнологичной промышленной продукции ""Ростех""",1,372,0.49609375
145464,Роструд,Проект ведомственного акта,"Об утверждении типовой формы соглашения, заключаемого федеральными операторами с исполнительными органами субъектов Российской Федерации, осуществляющими полномочия в сфере занятости населения, определяющего условия и порядок их взаимодействия при организации профессионального обучения и дополнительного профессионального образования, а также при реализации мероприятий по содействию занятости граждан, прошедших профессиональное обучение или получивших дополнительное профессиональное образование",1,335,0.5703125
145463,Следственный комитет Российской Федерации,Проект ведомственного акта,О внесении изменений в приказ Следственного комитета Российской Федерации от 17 августа 2022 г. № 101 «О награждениях и поощрениях в Следственном комитете Российской Федерации»,1,285,0.4951171875
145462,ФАС России,Проект ведомственного акта,"Об утверждении Типовой формы экспертного заключения
исполнительного органа субъекта Российской Федерации в области государственного регулирования цен (тарифов) об обоснованности предложений организации, осуществляющей услуги по транспортировке газа по газораспределительным сетям",1,437,0.576171875
145459,Минобороны России,Проект ведомственного акта,"приказ Министра обороны Российской Федерации ""Об учреждении почетного звания в Министерстве обороны Российской Федерации ""Почетный специалист инженерных войск""",1,183,0.4296875
145458,Минобрнауки России,Проект постановления Правительства Российской Федерации,"О внесении изменений в перечень некоммерческих организаций, получаемые налогоплательщиками гранты, премии, призы и (или) подарки которых в денежной и (или) натуральной формах по результатам участия в соревнованиях, конкурсах, иных мероприятиях не подлежат налогообложению",1,296,0.640625
145457,Следственный комитет Российской Федерации,Проект ведомственного акта,О внесении изменений в приказ Следственного комитета Российской Федерации от 17 августа 2022 г. № 101 «О награждениях и поощрениях в Следственном комитете Российской Федерации,1,331,0.4931640625
145456,Минобороны России,Проект ведомственного акта,Об учреждении почетного звания Министерства обороны Российской Федерации «Почетный работник культуры Вооруженных Сил Российской Федерации»,0,336,0.39453125
145454,Минэкономразвития России,Проект постановления Правительства Российской Федерации,О внесении изменений в постановление Правительства Российской Федерации от 28 ноября 2018 г. № 1425,1,587,0.376953125
145460,Росприроднадзор,Проект ведомственного акта,Об утверждении условий оплаты труда работников центрального аппарата и территориальных органов Федеральной службы по надзору в сфере природопользования,1,303,0.4140625
145453,Росздравнадзор,Проект ведомственного акта,"О внесении изменений в Положение о Комиссии по соблюдению требований к служебному поведению федеральных государственных гражданских служащих центрального аппарата, руководителей и заместителей руководителей территориальных органов Федеральной службы по надзору в сфере здравоохранения, работников организаций, созданных для выполнения задач, поставленных перед Федеральной службой по надзору в сфере здравоохранения, и урегулированию конфликта интересов, утвержденное приказом Федеральной службы по надзору в сфере здравоохранения от 14 февраля 2023 г. № 821",1,297,0.583984375
145452,Минфин России,Проект ведомственного акта,"О внесении изменений в Порядок санкционирования операций со средствами, поступающими во временное распоряжение получателей средств федерального бюджета, утвержденный приказом Министерства финансов Российской Федерации от 23 июня 2020 г. № 119н",1,331,0.56640625
145451,СФР,Проект ведомственного акта,О признании утратившим силу приказа Фонда социального страхования Российской Федерации от 9 ноября 2017 г. № 543 «Об утверждении формы паспорта инвестиционного проекта в отношении объекта капитального строительства государственной собственности Российской Федерации»,0,299,0.56640625
145448,Минтруд России,Проект ведомственного акта,"Об утверждении перечня сведений, содержащихся в банке данных о законных представителях лиц, имеющих право на получение мер социальной защиты (поддержки), социальных услуг, предоставляемых в рамках социального обслуживания и государственной социальной помощи, иных социальных гарантий и выплат, включая информацию о внесении исправлений или изменений в указанные сведения, предоставляемые из государственной информационной системы «Единая централизованная цифровая платформа в социальной сфере» в федеральную государственную информационную систему «Единая система идентификации и аутентификации в инфраструктуре, обеспечивающей информационно-технологическое взаимодействие информационных систем, используемых для предоставления государственных и муниципальных услуг в электронной форме», в том числе для последующей передачи в федеральную государственную информационную систему «Единый портал государственных и муниципальных услуг (функций)» с использованием единой системы межведомственного электронного взаимодействия",1,731,0.583984375
145449,Минтруд России,Проект ведомственного акта,"Об утверждении перечня подсистем информационных систем, входящих в состав государственной информационной системы «Единая централизованная цифровая платформа в социальной сфере»",1,760,0.4580078125
145447,Минтруд России,Проект ведомственного акта,О внесении изменений и признании утратившими силу некоторых приказов Министерства труда и социальной защиты Российской Федерации,1,740,0.3681640625
145450,Россельхознадзор,Проект ведомственного акта,"приказ Россельхознадзора ""О внесении изменений в приказ Федеральной службы по ветеринарному и фитосанитарному надзору от 22 марта 2021 г. № 282 «Об установлении Порядка приостановления реализации и применения лекарственных препаратов для ветеринарного применения""",0,334,0.59375
145446,Минприроды России,Проект ведомственного акта,Об утверждении Положения о национальном парке «Тульские засеки»,1,280,0.2548828125
145444,ФФОМС,Проект ведомственного акта,Об утверждении формы и порядка представления отчета об использовании средств иных межбюджетных трансфертов из бюджета Федерального фонда обязательного медицинского страхования бюджетам территориальных фондов обязательного медицинского страхования на финансовое обеспечение осуществления денежных выплат стимулирующего характера медицинским работникам за выявление онкологических заболеваний в ходе проведения диспансеризации и профилактических медицинских осмотров населения,1,357,0.5751953125
145443,Минпромторг России,Проект постановления Правительства Российской Федерации,О внесении изменений в постановление Правительство Российской Федерации от 6 марта 2022 г. № 295,1,606,0.361328125
145445,Минпромторг России,Проект постановления Правительства Российской Федерации,"Об утверждении размера понижающего коэффициента к нормативу утилизации отходов от использования товаров, к массе произведенной упаковки, отходы от использования которых подлежат утилизации, произведенных с использованием вторичного сырья, и порядка подтверждения производства товаров с использованием вторичного сырья",0,742,0.6474609375
145442,Минтранс России,Проект ведомственного акта,Об утверждении Обязательных постановлений в морском порту Корсаков,1,395,0.2568359375
145441,Минстрой России,Проект ведомственного акта,"Об утверждении методики определения норматива стоимости одного квадратного метра общей площади жилого помещения
по Российской Федерации и расчета показателей средней рыночной стоимости одного квадратного метра общей площади жилого помещения
по субъектам Российской Федерации",1,530,0.583984375
145439,Минфин России,Проект ведомственного акта,"Об утверждении Порядка составления, утверждения и ведения бюджетных смет Министерства финансов Российской Федерации и федеральных казенных учреждений, находящихся в ведении Министерства финансов Российской Федерации",1,320,0.5380859375
145438,Минтруд России,Проект ведомственного акта,"Об утверждении Порядка размещения в информационно-телекоммуникационной сети «Интернет» сводной информации о трудоустройстве выпускников организаций, осуществляющих образовательную деятельность",0,585,0.5009765625
