projectId,department,document_type,title,progress,views,project_card_size_Kb
146100,Минздрав России,Проект постановления Правительства Российской Федерации,О внесении изменений в постановление Правительства Российской Федерации от 19 июня 2012 г. № 608,1,315,0.3544921875
146099,Минздрав России,Проект постановления Правительства Российской Федерации,О внесении изменений в постановление Правительства Российской Федерации от 30 июня 2004 г. № 323,1,358,0.3544921875
146098,Минздрав России,Проект ведомственного акта,"Об утверждении общих требований к организации посещения пациента в медицинской организации, оказывающей психиатрическую помощь",1,556,0.3671875
146097,Минздрав России,Проект ведомственного акта,"Об утверждении Порядка оповещения законного представителя пациента, либо одного из родственников пациента, либо иного лица по указанию пациента о поступлении пациента в медицинскую организацию, оказывающую психиатрическую помощь в стационарных условиях, в недобровольном порядке",1,350,0.58203125
146095,Минсельхоз России,Проект постановления Правительства Российской Федерации,О внесении изменения в постановление Правительства Российской Федерации от 30 июня 2021 г. № 1079,1,253,0.359375
146094,ФАС России,Проект постановления Правительства Российской Федерации,О внесении изменений в Положение о Федеральной антимонопольной службе,1,354,0.306640625
146093,Минпросвещения России,Проект ведомственного акта,"Приказ ""Об утверждении федерального государственного образовательного стандарта среднего профессионального образования по профессии 54.01.21 Изготовитель художественных изделий из твердых материалов (по видам, за исключением металла)""",1,162,0.568359375
146092,Минпросвещения России,Проект ведомственного акта,"Приказ ""Об утверждении федерального государственного образовательного стандарта среднего профессионального образования по специальности 38.02.01 Экономика и бухгалтерский учет (по отраслям)""",1,223,0.48828125
146091,Минпромторг России,Проект постановления Правительства Российской Федерации,О внесении изменения в постановление Правительства Российской Федерации от 16 июля 2015 г. № 708,1,355,0.3603515625
146090,Минпросвещения России,Проект ведомственного акта,"Приказ ""Об утверждении федерального государственного образовательного стандарта среднего профессионального образования по специальности 36.02.05 Кинология""",1,160,0.4267578125
146088,Минпросвещения России,Проект ведомственного акта,"Приказ ""Об утверждении федерального государственного образовательного стандарта среднего профессионального образования по специальности 36.02.04 Охотоведение и звероводство""",1,152,0.4599609375
146087,Минпросвещения России,Проект ведомственного акта,"Приказ ""Об утверждении федерального государственного образовательного стандарта среднего профессионального образования по профессии 36.01.06 Мастер оленеводства""",1,157,0.4375
146086,Минпросвещения России,Проект ведомственного акта,"Приказ ""Об утверждении федерального государственного образовательного стандарта среднего профессионального образования по профессии 36.01.03 Тренер-наездник лошадей""",1,150,0.4443359375
146084,Минпросвещения России,Проект ведомственного акта,"Приказ ""Об утверждении федерального государственного образовательного стандарта среднего профессионального образования по специальности 35.02.19 Техническое обеспечение рыбоводства""",1,158,0.4755859375
146083,Минпросвещения России,Проект ведомственного акта,"Приказ ""Об утверждении федерального государственного образовательного стандарта среднего профессионального образования по профессии 35.01.34 Аппаратчик-оператор производства продукции из водных биоресурсов на судах рыбопромыслового флота и береговых предприятиях""",1,156,0.5986328125
146082,Минпросвещения России,Проект ведомственного акта,"Приказ ""Об утверждении федерального государственного образовательного стандарта среднего профессионального образования по специальности 31.02.07 Стоматологическое дело""",1,209,0.451171875
146085,Росрыболовство,Проект ведомственного акта,"О внесении изменения в Положение о знаке отличия
Федерального агентства по рыболовству «90 лет органам рыбоохраны России», утвержденное приказом Росрыболовства от 30 ноября 2023 г. № 674",1,164,0.4599609375
146080,Минпросвещения России,Проект ведомственного акта,"Приказ ""Об утверждении федерального государственного образовательного стандарта среднего профессионального образования по специальности 29.02.05 Технология текстильных изделий (по видам)""",1,168,0.4833984375
146096,Минздрав России,Проект постановления Правительства Российской Федерации,"Об утверждении Правил признания территории лечебно-оздоровительной местностью федерального значения, курортом федерального значения или курортным регионом, Правил признания территории лечебно-оздоровительной местностью регионального значения или курортом регионального значения и Правил установления, изменения границ и упразднения лечебно-оздоровительной местности, курорта или курортного региона",0.678571,298,0.6357421875
146089,ФАС России,Проект постановления Правительства Российской Федерации,"О внесении изменений в постановление
Правительства Российской Федерации от 10 февраля 2015 г. № 107",0.904762,328,0.3408203125
146079,Минэкономразвития России,Проект федерального закона,проект федерального закона «О внесении изменений в Кодекс Российской Федерации об административных правонарушениях» (в части смягчения административной ответственности за нарушение классифицированными средствами размещения правил регистрационного и миграционного учета),1,335,0.611328125
146078,Минпросвещения России,Проект ведомственного акта,"Приказ ""Об утверждении федерального государственного образовательного стандарта среднего профессионального образования по профессии 29.01.28 Мастер по обработке алмазов""",1,160,0.451171875
146077,Минпросвещения России,Проект ведомственного акта,"Приказ ""Об утверждении федерального государственного образовательного стандарта среднего профессионального образования по специальности 25.02.07 Техническое обслуживание авиационных двигателей""",1,163,0.498046875
146073,Минпросвещения России,Проект ведомственного акта,"Приказ ""Об утверждении федерального государственного образовательного стандарта среднего профессионального образования по специальности 25.02.06 Производство и обслуживание авиационной техники""",1,161,0.4970703125
146075,Минтруд России,Проект ведомственного акта,"О внесении изменений в форму и порядок заполнения протокола проведения медико-социальной экспертизы гражданина, утвержденные приказом Министерства труда и социальной защиты Российской Федерации от 4 июля 2022 г. № 389н",1,200,0.521484375
146072,Росстат,Проект ведомственного акта,Об утверждении Положения об организации и ведении гражданской обороны в центральном аппарате и территориальных органах Федеральной службы государственной статистики,1,162,0.4228515625
146071,Рослесхоз,Проект ведомственного акта,"Об утверждении Административного регламента Федерального агентства лесного хозяйства по предоставлению государственной услуги «Предварительное согласование предоставления лесных участков, расположенных на землях лесного фонда, для реализации приоритетных инвестиционных проектов в целях развития лесного комплекса»",1,198,0.5732421875
146070,Минпросвещения России,Проект ведомственного акта,"Приказ ""Об утверждении федерального государственного образовательного стандарта среднего профессионального образования по специальности 25.02.01 Техническая эксплуатация летательных аппаратов и двигателей""",1,157,0.51953125
146074,Минобрнауки России,Проект ведомственного акта,"О внесении изменений в правила формирования перечня рецензируемых научных изданий, в которых должны быть опубликованы основные научные результаты диссертаций
на соискание ученой степени кандидата наук, на соискание ученой степени доктора наук, утвержденные приказом Министерства науки
и высшего образования Российской Федерации
от 31 мая 2023 г. № 534",1,233,0.5859375
146069,Минпросвещения России,Проект ведомственного акта,"Приказ ""Об утверждении федерального государственного образовательного стандарта среднего профессионального образования по специальности 23.02.09 Автоматика и телемеханика на транспорте (железнодорожном транспорте)""",1,156,0.5341796875
146068,Федеральное агентство по делам национальностей,Проект постановления Правительства Российской Федерации,"Об утверждении Порядка подготовки и распространения, в том числе опубликования, ежегодного государственного доклада о реализации государственной национальной политики Российской Федерации",1,175,0.591796875
146067,Минпросвещения России,Проект ведомственного акта,"Приказ ""Об утверждении федерального государственного образовательного стандарта среднего профессионального образования по профессии 23.01.19 Оператор по обработке перевозочных документов на железнодорожном транспорте""",1,159,0.541015625
146066,Минобрнауки России,Проект ведомственного акта,"О внесении изменения в пункт 2 Порядка предоставления из федерального бюджета федеральному государственному бюджетному образовательному учреждению высшего образования «Московский государственный университет имени М.В. Ломоносова», федеральному государственному бюджетному образовательному учреждению высшего образования «Российская академия народного хозяйства и государственной службы при Президенте Российской Федерации», федеральному государственному бюджетному образовательному учреждению высшего образования «Российская академия живописи, ваяния и зодчества Ильи Глазунова», федеральному государственному бюджетному образовательному учреждению высшего образования «Санкт-Петербургский государственный университет» субсидий в соответствии с абзацем вторым пункта 1 статьи 78.1 Бюджетного кодекса Российской Федерации, утвержденный приказом Министерства науки и высшего образования Российской Федерации от 3 марта 2021 г. № 149",1,172,0.5908203125
146065,Минпросвещения России,Проект ведомственного акта,"Приказ ""Об утверждении федерального государственного образовательного стандарта среднего профессионального образования по профессии 23.01.17 Мастер по ремонту и обслуживанию автомобилей""",1,175,0.482421875
146064,Минтранс России,Проект постановления Правительства Российской Федерации,"Об утверждении требований по обеспечению транспортной безопасности, в том числе требований к антитеррористической защищенности объектов (территорий), учитывающих уровни безопасности для объектов транспортной инфраструктуры морского и внутреннего водного транспорта, не подлежащих категорированию, предназначенных для обслуживания пассажиров и транспортных средств морского и внутреннего водного транспорта",0.678571,302,0.6328125
146063,Минпросвещения России,Проект ведомственного акта,"Приказ ""Об утверждении федерального государственного образовательного стандарта среднего профессионального образования по профессии 18.01.08 Мастер по изготовлению, обработке, отделке деталей и изделий из стекла""",1,167,0.52734375
146062,Минпросвещения России,Проект ведомственного акта,"Приказ ""Об утверждении федерального государственного образовательного стандарта среднего профессионального образования по профессии 13.01.16 Электромонтер по техническому обслуживанию и ремонту оборудования подстанций и сетей""",1,168,0.556640625
146060,Минпросвещения России,Проект ведомственного акта,"Приказ ""Об утверждении федерального государственного образовательного стандарта среднего профессионального образования по специальности 09.02.10 Разработка компьютерных игр, дополненной и виртуальной реальности""",1,325,0.529296875
146061,Минэкономразвития России,Проект ведомственного акта,"О внесении изменений в Перечень областей специализации
технических экспертов, утвержденный приказом Минэкономразвития России от 23 мая 2014 г. № 285",1,234,0.4130859375
146059,Минобороны России,Проект ведомственного акта,"Об учреждении почетного звания Министерства обороны Российской Федерации ""Почетный специалист инженерных войск""",1,216,0.3427734375
146057,Минпросвещения России,Проект ведомственного акта,"Приказ ""Об утверждении федерального государственного образовательного стандарта среднего профессионального образования по специальности 08.02.12 Строительство и эксплуатация автомобильных дорог, аэродромов и городских путей сообщения""",1,180,0.5712890625
146056,Росгидромет,Проект ведомственного акта,"О внесении изменения в Перечень работ федерального назначения в области гидрометеорологии и смежных с ней областях, утвержденный приказом Росгидромета от 13 июля 2021 г. № 218",1,182,0.4453125
146055,Росгидромет,Проект ведомственного акта,"Об утверждении Административного регламента Федеральной службы по гидрометеорологии и мониторингу окружающей среды по предоставлению государственной услуги
«Лицензирование деятельности в области гидрометеорологии и смежных с ней областях (за исключением указанной деятельности, осуществляемой в ходе инженерных изысканий, выполняемых для подготовки проектной документации, строительства, реконструкции объектов капитального строительства)»",1,197,0.5751953125
146051,Роснедра,Проект ведомственного акта,Об утверждении Порядка получения федеральными государственными гражданскими служащими Федерального агентства по недропользованию и его территориальных органов разрешения представителя нанимателя на участие на безвозмездной основе в управлении некоммерческими организациями,1,196,0.5732421875
146050,Минтруд России,Проект постановления Правительства Российской Федерации,О внесении изменений в Положение о Министерстве труда и социальной защиты Российской Федерации,1,220,0.359375
146049,Минтруд России,Проект ведомственного акта,"Об утверждении поправочного коэффициента размера средней рыночной стоимости 1 кв. метра общей площади жилья, применяемого для расчета единовременной субсидии на приобретение жилого помещения, предоставляемой
федеральным государственным гражданским служащим, проходящим федеральную государственную гражданскую службу в субъектах Российской Федерации - городах федерального значения, на II квартал 2024 года",0,160,0.599609375
146048,МИД России,Проект ведомственного акта,"О внесении изменения в пункт 11 Служебного распорядка центрального аппарата Министерства иностранных дел Российской Федерации, территориальных органов - представительств Министерства иностранных дел Российской Федерации на территории Российской Федерации, дипломатических представительств и консульских учреждений Российской Федерации, представительств Российской Федерации при международных организациях (межгосударственных, межправительственных), утвержденных приказом Министерства иностранных дел Российской Федерации от 23 июля 2009 г. № 11868",1,203,0.5751953125
